{
 "schema": 1,
 "writer": "morning",
 "at": "2026-10-16T14:00:00Z",
 "source": "morning 4:25",
 "release": "v4.0.0",
 "pipeline": "morning",
 "startedAt": "2026-10-16T09:25:00Z",
 "endedAt": "2026-10-16T09:31:00Z",
 "status": "ok",
 "steps": [
  {
   "id": "gate",
   "status": "ok"
  }
 ],
 "push": "A made-up push line"
}